framenr,kanji,keyword,public,last_edited,story
1718,陰,"shade",1,2016-06-30 14:24:35,"Pinnacle | (clock / rising cloud)
gyre and gimble in the wabe.
Wabe as the shade around the sundial (top right), rising cloud as the mysterious cyclical nature of time (matched with periodic signals seen by the sundial's motions).
Pinnacle to think of the sun being directly overhead and all the shade appearing to disappear."
1719,予,"beforehand",1,2016-06-30 14:31:00,"The 予 in 予約, a reservation, a booking that you make beforehand.
The martial arts club booked a restaurant for their annual dinner, but the bouncers wouldn't let them in unless they agreed beforehand that nobody would bring any halberds.
Don't confuse with ""previously"", though ""previous"" is a meaning of this kanji."
1720,序,"preface",1,2016-06-30 14:35:04,"Batman and Robin are about to do some halberd training, but beforehand we have to preface that with a segment showing them sliding down their poles into their costumes.
I'm keeping both halberd and beforehand here and it should be obvious which is the correct one to put in the bat-cave to give the meaning ""preface""."
1721,預,"deposit",1,2016-06-30 14:38:44,"Thanks for ""atama kin"". That helps with ""head"" part. So before you can rent or move into an apartment, you must deposit the money beforehand and use it to pay the atama kin.
Other countries have a ""damage deposit"" so similar sense of deposit should be easy enough to recall (say, paid beforehand to the head of the building)"
1722,野,"plains",1,2016-06-30 14:42:06,"Used in 野球 (baseball) and the surname 野原.
Ri | beforehand
Think of an endless, flat landscape. Nothing but ri upon ri (think ""acre upon acre"") of flat land ""beforehand"" (pun, meaning in front) and ri upon ri ""behindhand""."
1723,兼,"concurrently",1,2016-06-30 14:51:01,"Think of it like a wheelbarrow that is too full of tools because you're trying to do too many things at once. Horns at front indicate divided attention, rake across the side asking for trouble (sticking out like that). Then two central lines are like the handles, each connected to a different goal. Final two strokes are other tools falling off the side."
1724,嫌,"dislike",1,2016-06-30 14:52:37,"Women multi-task (do/think things concurrently) and dislike men's ""one-track mind"" (it's always sex, eh?)"
1725,鎌,"sickle",1,2016-06-30 14:59:52,"In Battle Royale, one of the characters uses a kama (a sickle, this kanji) to commit a murder-suicide. The sharp metal blade cut the necks of both girls concurrently."
1726,謙,"self-effacing",1,2016-06-30 15:01:33,"Someone who says of himself that he is a ""jack of all trades, master of none"" (in keeping with the idea of doing things concurrently but not doing them well)"
1727,廉,"bargain",1,2016-06-30 15:08:59,"Bargain in the sense of ""low price"".
bat-cave, concurrently
The reason Batman got such a bargain on the bat-cave is that the lease stipulates that the bats get to live there concurrently."
1729,価,"value",1,2016-06-30 15:13:35,"The value of a person's life in the Old West isn't much at all."
1730,要,"need",1,2016-06-30 15:19:35,"Old west / woman
Old film called ""Mars Needs Women"". I think it might be a western."
1731,腰,"loins",1,2016-06-30 15:21:58,"body part | needs
The loins are a part of the body that have needs of their own?"
1732,票,"ballot",1,2016-06-30 15:28:14,"In the old west, the mayor (as decided by a ballot) always had to show himself to be a god-fearing man (altar underneath). Doesn't matter if they were or not, just that they have to show themselves at the altar."
1733,漂,"drift",1,2016-06-30 15:33:30,"water | ballot
US citizens are always ready to wash away leaders at the ballot box if it seems that they're drifting away from ""Christian"" principles."
1734,標,"signpost",1,2016-06-30 15:36:17,"tree | ballot
Were the trees balloted before we all decided to turn them all into signposts? I guess they would have found it difficult to find the polling stations if we didn't signpost them in the first place. A catch-22 that will forever keep trees from having a say in a constitutional democracy."
1735,栗,"chestnut",0,2016-06-30 15:38:30,"Chestnut, west nut tree."
1736,慄,"shudder",1,2016-06-30 15:42:56,"state of mind, chestnut
I once sliced my finger open while trying to open a chestnut. In that state of mind, I shuddered with fear, afraid to look to see how much damage I'd done."
1737,遷,"transition",1,2016-06-30 15:48:45,"The film ""Unforgiven"" was set at a transition point between the Old West and the new. I don't remember dogs and snakes on the roads, but I guess these staples of the old west would have been there, sharing the road with new auto-mobiles. This kanji doesn't show the new west (or cars) but it does see the old west heading on down the road, to be replaced with something new.
Also, the sun sets in the west, and maybe the dogs and snakes travel the road with it as we make the transition from day to night."
1738,覆,"capsize",1,2016-06-30 16:10:31,"ISIS believes that the west is the Great Satan so by their acts of terror they are hoping to capsize/overturn western states and restore the medieval idea of a global caliphate."
1739,煙,"smoke",1,2016-06-30 16:13:33,"Think smoke signals. Fire is the main element, then west because it's what we associate with the wild west, then finally ground because seeing them means you're in ""Indian territory"""
1740,南,"south",1,2016-06-30 16:22:13,"You could say that people living in the south, in the Bible belt are happier.
I don't like Heisig's reading of ""happiness"" here, though. The proportions are all wrong and this kanji doesn't have the ""happy"" symmetry in the original.
As ten-glass canopy-yen I'm going to imagine going to a chicken nanban (チキン南蛮, a dish invented in the southern city of Nobeoka) restaurant where they have a display of ten different varieties, each in their own glass case with a different cost in yen for each."
1741,楠,"camphor tree",1,2016-06-30 16:25:01,"Tree of the south. I'm going to think of this as a Eucalyptus tree (camphor trees contain similar volatile chemicals). Then it becomes easy to associate south since we all know that Australia is down near the south pole somewhere."
1742,献,"offering",1,2016-06-30 16:27:28,"If a South Korean makes you an offering of a hot dog, better make sure it's not made of chihuahua!"
1743,門,"gates",1,2016-06-30 17:24:28,"saloon-style swing-door gate"
1744,問,"question",1,2016-06-30 17:25:03,"Put your mouth up to the hole in the gate and ask your question."
1745,閲,"review",1,2016-06-30 17:27:03,"Review your old physics textbooks and you may come across the idea of ""Maxwell's demon"". It's a little devil that stands at the gate, reviewing how hot/cold each particle that wants to pass is and only lets cold ones go one way, hot ones the other."
1746,閥,"clique",1,2016-06-30 17:33:28,"gate-fell
Think of the story of shibboleths from the Bible. People trying to escape across a river (Ephraimites) are asked to pronounce the word (by Gileadites). If they pronounced it differently from their own clique, they were identified as an outsider and felled where they stood.
It's easier to think of this in terms of a clique being an ""ingroup"" and the others being ""outgroup"", thus subject to being felled. Wonderful people, these Jewish tribes ..."
1747,間,"interval",1,2016-06-30 17:35:36,"Think of gated communities set up along a travel route. The interval between them is such that you should be able to travel the distance in just one day, so you're not left in the wilderness between after dark."
1748,闇,"pitch dark",1,2016-06-30 17:37:34,"Six senses are like gates. If only sound enters through your gate then it must be pitch dark. Note how ""sound"" also appears in ""darkness"""
1749,簡,"simplicity",1,2016-06-30 17:43:14,"bamboo interval
Part of 簡単, a full word for simple. Never knew that that clacking bamboo thing was called ししおどし. Apparently it's used to scare away birds.
I'm going a slightly different way by saying that this bamboo device demonstrates the sheer simplicity of using water to measure off equal intervals."
1750,開,"open",1,2016-06-30 17:43:53,"gates-two hands
Obviously pushing the gate open with two hands."
1751,閉,"closed",1,2016-06-30 17:47:02,"gates-genie...
Hmm... forgetting genie (or at least this way of drawing it). Looks like a katakana オ, too, so I'll say ""oh, we're too late---the gates have already closed""
If I can remember genie, then I'll go with the gates being closed by a genie who will only open them if you tell him the magic word."
1752,閣,"tower",1,2016-06-30 17:54:48,"gates-each
Think of ""chess tower"", ie ""rook""/""castle"". These towers reside at each corner of the chessboard at the start. They are slow out of the gates because they are surrounded by other pieces and far from the centre."
1753,閑,"leisure",1,2016-06-30 17:57:06,"We already have a tree in the kanji for ""rest"", so let that be a reminder that there's a tree here, too. Imagine guys in a saloon on a rainy day, enjoying a game of Mah Jongg or something, looking out and seeing a restful tree beyond."
1754,聞,"hear",1,2016-06-30 17:58:19,"Make a set with ""question"". One person puts their mouth to the gate to ask to be let in (the question), while the person on the other side puts their ear up to hear."
1755,潤,"wet",1,2016-06-30 17:59:33,"watery gated king
Very good. Someone put a bucket of water over the king's personal gate and now he's all wet."
1756,欄,"column",1,2016-06-30 18:04:26,"Tree, gate, east
Lafcadio Hearne uprooted (hint: tree) from Europe and passed through the gateway leading to the east. There he wrote many newspaper columns about life in Japan (available as a collected work entitled ""Glimpses of Unfamiliar Japan"" from archive.org)"
1757,闘,"fight",1,2016-06-30 18:12:17,"gates,midget-glue
I think of Mr. Burns in The Simpsons. Think ""three stooges syndrome"": https://www.youtube.com/watch?v=gmBj8r1-fDo

He goes to the doctor who explains that he has every disease known to man, but that they're all in perfect balance. He uses a doorway (gate) to illustrate, with little midget versions of the three stooges all fighting to get through at once, leading to them all getting stuck (glue)"
1758,倉,"godown",1,2016-06-30 18:18:49,"OK, so like 99% of people, I have to look up what a godown is.
I'm going to think of it like: top three strokes as ""meeting"" (a meeting place for shipping containers, I guess). Half a gate as a big gantry (an overhead lift) for moving shipping containers around, with one shipping container waiting on the floor to be moved into the ""stacks""."
1759,創,"genesis",0,2016-06-30 18:19:49,"Back in the day the people were so excited to get hold of the Sega genesis they looted the godown with sabers."
1760,非,"un-",1,2016-06-30 18:24:58,"I think of McCarthy's anti-communist witch-hunts. That 4th stroke trying to make its own direction sure looks like a hippy or a communist. Definitely un-American!
Also, goatse cannot be unseen: http://boingboing.net/2007/06/04/london-2012-olympic.html
Argh. Pass the mind bleach!"
1761,俳,"haiku",1,2016-06-30 18:29:32,"Undo the myth that / Hiro invented haiku / He's just an actor.
(hey, maybe I should write all my stories as haiku!)"
1762,排,"repudiate",1,2016-06-30 18:36:09,"Seems to fit nicely with Plato's allegory of the cave. From their cell, where they have been chained all their lives, all the prisoners see are the shadows on the wall (as cast by their fingers, say). Since they do not know anything of the outside world, they repudiate its existence completely. It is an ""un"" thing to them.
https://en.wikipedia.org/wiki/Allegory_of_the_Cave"
1763,悲,"sad",1,2016-06-30 18:44:10,"悲しい.
Think of a songbird in a golden cage. No matter how fine the prison (jail cell), it still saddens the heart to be kept captive."
1764,罪,"guilt",1,2016-06-30 18:46:08,"net over jail cell
Justice is supposed to only net the guilty and throw them in jail cells (think of fish spilling out of a net) but it ain't always so."
1765,輩,"comrade",1,2016-06-30 18:48:47,"Somehow I get an image of the ""comrades"" (in scare quotes because they really make strange bedfellows) in Tarkovsky's 1979 film _Stalker_. There is a scene near the start where they are all making their way in a hand-operated railway car, heading for The Zone, which is really an ""un-place"", far removed from normal reality."
1766,扉,"front door",1,2016-06-30 18:52:07,"Think of Jim Henson's film ""The Cube"" (look it up!). A man is trapped in a room, but by the end, he just decides that he won't leave. Obvious connection with door and prison cell. Two ways to think of ""front door"" here: one is the obvious exit, the other is that the entire ""fourth wall"" (the one facing the audience) is completely open, allowing him to walk out whenever he wants."
1767,侯,"marquis",1,2016-06-30 18:55:54,"The Marquis de Sade (a real person) apparently enjoys songs in the key of PAIN. Here pictured throwing darts up towards the ceiling and allowing them to land back down on his head.
(the real Marquis de Sade was a lot less sadistic/masochistic, though)"
1768,喉,"throat",1,2016-06-30 18:58:48,"He opened his mouth as wide as a marquee so that his throat was practically distended. (think Munch's Scream if it helps)"
1769,候,"climate",1,2016-06-30 19:04:42,"Has meanings of climate, season, weather, wait for and expect.
Remember climate -> season and then think of the Sphinx's riddle being posed to the Marquis de Sade.
What has four legs in the morning, two in the afternoon and three at night? The Marquis de Sade (three legs = person with walking stick, obviously)"
1770,決,"decide",1,2016-06-30 19:10:35,"One key dog will decide the battle. Will he turn the tide or get the guillotine?
In the hitch-hiker's guide to the galaxy adventure game, what you decide to do with the dog just before using the sub-etha thumb for hitch-hiking will literally decide the fate of the human race. So break convention and think of a dog as the decider, not humans.
decide, deicide, believing in dog, you decide"
1771,快,"cheerful",1,2016-06-30 19:15:11,"Simplest way to approach this is thinking of cigars, especially those that are big enough to need a type of guillotine to chop off the end. ""Happiness is a cigar called Hamlet"" ads from the late 60's onwards. A nice cheerful look at a product that can kill you in a horribly agonising way.
https://www.youtube.com/watch?v=NIckHmwZAeI"
1772,偉,"admirable",1,2016-06-30 19:42:28,"I'm going to call the bit on the right a ""chastity belt"" because it's fiendishly complicated and also very funny. It doesn't hurt that the RHS is the radical for ""tanned leather""
First of all, you notice that it doesn't quite allow you to ""go"" (五). Then you try loosening it with your mouth, but whatever you try is only a half measure: you can't fit a full cock in to a half-cock hole, so the protection works.
That said, an admirable person is one who wears a chastity belt."
1773,違,"difference",1,2016-06-30 19:32:49,"chastity belt / road
You think that you've figured out how to get past the chastity belt, but you've gone down the wrong road. You can't tell the difference, but your partner can (ie, wrong hole)."
1774,緯,"horizontal",1,2016-06-30 19:34:44,"Finally, you defeat the chastity belt and ""get horizontal"" by suspending your partner (and strategic parts of the chastity belt) from some strings, like an Airfix model."
1775,衛,"defence",1,2016-06-30 19:38:25,"See ""boulevard"" (hint: Lou Reed's song ""Dirty Boulevard"").
Women, a chastity belt is your last line of defence against anyone wanting to slip up your dirty boulevard."
1776,韓,"Korea",1,2016-06-30 19:47:22,"Don't hate me Koreans, but ...
In the lands of mists ... No, wait. That's not the right way to start. The place is Korea, where everything is made of kimchi--even the chastity belts. You can tell straight away when a woman wearing one is near from the mists of still-fermenting cabbage wafting up from her nether regions."
1777,干,"dry",1,2016-07-01 14:14:26,"Go with Heisig's rotary clothesline idea."
1778,肝,"liver",1,2016-07-01 14:15:37,"body part | dry
The drunk had to dry out due to liver damage."
1779,刊,"publish",1,2016-07-01 14:17:12,"You might think that once something is published, it's all ""dry and cut"". However, ""Don't believe half of what you read and none of what you hear"""
1780,汗,"sweat",1,2016-07-01 14:17:56,"Water drying (evaporating) is why sweating cools you down."
1781,軒,"flats",1,2016-07-01 14:19:37,"Flats... burnt-out cars and washing hanging from clothes-lines strung up outside the windows."
1782,岸,"beach",1,2016-07-01 14:20:05,"Beneath the mountain and cliff there's a dry bit before the sea. Must be a beach."
1783,幹,"tree trunk",1,2016-07-01 14:22:41,"Think of a tree's drip-line. It doesn't get much rain (though if it's humid there will be a mist). Then on the right there's an umbrella (the tree's canopy) with a dry patch underneath. Imagine sitting with your back to the tree-trunk and enjoying this pleasant place out of the rain."
1784,芋,"potato",1,2016-07-01 14:26:37,"Although potatoes can be propagated by their flowers/fruit, it's more usual to ""chit them"" by storing them in a dry, frost-free place. Think of that hook at the end as one of the ""eyes"" that will sprout a full plant."
1785,宇,"eaves",1,2016-07-01 14:27:21,"You've heard of a couch potato: someone who doesn't leave the couch. A ""house potato"" is someone who never goes beyond their own eaves."
1786,余,"too much",1,2016-07-01 14:28:49,"Keyword confused me a bit (was thinking ""overdo""). This is the kanji for ""amari""

If your potato plants have too much shade (like an umbrella overhead, for example!) then you'll only grow little marble potatoes."
1787,除,"exclude",1,2016-07-01 14:37:31,"Pinnacle, scale
There's a road going up a steep mountain pass. Big trucks are excluded from travelling the road, so a scale is set up to weigh everything. Anything that's excluded from going over the pinnacle has to take the longer way around."
1788,徐,"gradually",1,2016-07-01 14:38:38,"Think of a graduated cylinder with ""line"" on the left having various markings. In fact, imagine both sides as a kind of scale as you're gradually filling up the cylinder."
1789,叙,"confer",1,2016-07-01 14:44:53,"Think of being conferred a degree. I'll go with the Japanese words for both halves. Your tests results are 余り（あまり）良くない so you go to your professor who unfortunately tells you that you'll have to sit your exams again (又、また）or you won't be conferred."
1790,途,"route",1,2016-07-01 14:46:31,"Think GPS route planner. The better ones can take account of road conditions and use that as a scaling factor for any particular part of the journey (ie, pretending that the road is longer than it actually is), thus suggesting a more optimal route for you."
1791,斜,"diagonal",1,2016-07-01 14:52:46,"too much - measuring cup
Imagine a spreadsheet used to count calories (to stop you from eating too much). Two columns: one for the breakdown of carbs in each ingredient, the other being the total. If there is too much in the left column, then you're blowing your budget (too big a measuring cup) on the right. As for diagonal, imagine diagonal lines connecting the carb breakdown numbers to the sum on the bottom right. (diagonal lines showing the many-to-one mapping between individual items and the sum)"
1792,塗,"paint",1,2016-07-01 14:54:51,"Put too much paint (water + too much) on your roller and it will drip all over the ground."
1793,束,"bundle",1,2016-07-01 14:55:50,"I'm going to think of this as a faggot. Old English word for a bundle of firewood. Then tree is obvious, and the mouth in the middle represents the bundle."
1794,頼,"trust",1,2016-07-01 14:59:01,"You may not trust faggots (old name for bundle of firewood; imagine sitting ""with your back to the wall"" out of mistrust), but for the most part any fears about what might happen are all in your head."
1795,瀬,"rapids",1,2016-07-01 14:59:51,"You need two things for rapids. One is that you need to have a sufficient head of water (ie, elevation), the other is that the river has to be all bundled up into a tight space."
1796,勅,"imperial order",1,2016-07-01 15:03:07,"The emperor made an order that all faggots had to work out at the gym to build their muscles so that visiting dignitaries would not think his countrymen were effete and easily invaded."
1797,疎,"alienate",1,2016-07-01 15:06:21,"In the kanji zoo, alienate felt really alienated. All the other kanji formed easy bundles with each other, but alienate stood alone in a bundle of one, completely alienated."
1798,辣,"bitter",1,2016-07-01 15:09:48,"The bitter and spicy flavours that we sense are actually handled by different nerve bundles. (bitter is a bundle particular to that flavour, while spiciness involves bundles of pain receptors)"
1799,速,"quick",1,2016-07-01 15:10:30,"A rushed parent quickly bundles up their kids and gets them out on the road for school."
1800,整,"organize",1,2016-07-01 15:13:11,"Rather than relying on speed to get their kids out early in the morning (see speed), it pays to be more organised. Divide the job into little bundles and then have your internal taskmaster go through each one. Underlying all this is the need to organise everything correctly instead of rushing around like a headless chicken."
1801,剣,"saber",1,2016-07-01 15:31:32,"Interestingly, the LHS has the meaning ""all"", and not ""awl"" as Heisig puts it.
Also, a tsurugi (this kanji) is a double-bladed weapon, whereas a sabre has only one blade. I'm going to call both this kanji and the primitive on the LHS ""tsurugi"".
Top three strokes as ""meeting"": a long, straight sword can find meeting points between armour or bones (puncture weapon). Bisected mouth: two-bladed. Bottom two strokes: handle and tsuba (sword guard). Right side: a type of blade."
1802,険,"precipitous",1,2016-07-01 15:35:47,"Think of the English expression ""on a knife-edge"". So if precipitous is taken to mean ""dangerously high and steep"" then we get a combination of the two images: pinnacle meaning highest point, and tsurugi (Japanese long sword) being the knife-edge. It may help to consider ""precarious"" as a near-synonym for precipitous. That way there will be a much easier match between pinnacle and sword (edge)"
1803,検,"examination",1,2016-07-08 13:55:01,"tree-tsurugi
I'll go with a word-play and call the two primitives ""tree surgeon"". When my favourite tree started losing its leaves, I had to call in the tree surgeon to give it an examination.
(しら・べる、so it's like ""investigate"")
Note that the tree radical also appears on the left of ""exam"", while ""verification"" has horse-tsurugi."
1804,倹,"frugal",1,2016-07-01 15:52:11,"Hiro + tsurugi
Think of frugal = being economical. Hiro follows Bruce Lee's advice on fighting style, emphasising economy of motion. We can see that when he fells Skylar, not messing around and just running him through with economy of action.
(OK, Hiro uses a katana, not a tsurigi, but the running through action better suits a tsurigi, while a katana is better at slashing)"
1805,重,"heavy",1,2016-07-01 15:55:00,"Think of the story of the mathematician who wanted to be paid in rice. One grain for the first square of a chess board, two for the next and so on. We're talking 2 to the power of 65 (minus 1) grains. Not even one thousand ri of land would be enough to pay such a heavy reward."
1806,動,"move",1,2016-07-01 15:56:11,"heavy muscle
Think of movers. They lift heavy loads all day and so have big muscles."
1807,腫,"tumor",1,2016-07-01 15:57:23,"flesh that's dense (hence heavy) = a tumour. Or flesh that weighs heavily on you while you worry about it."
1808,勲,"meritorious deed",1,2016-07-01 16:09:50,"move over fire (or furniture mover over fire)
Think of the Simpsons episode where one of Mr. Burns' softball team players (José Canseco) runs into a burning building to save a woman's baby, then her cat and finally her piano. Surely that last bit of furniture moving is a good example of a meritorious deed?"
1809,働,"work",1,2016-07-01 16:13:20,"Hiro isn't really the kind of guy who is moved by his work. He feels like he has a higher destiny, apart from all the office grunt work."
1810,種,"species",1,2016-07-01 16:21:07,"Used in 種類 (Variety, kind, type, category). Both this kanji and ""class"" (類) have similar, overlapping meanings. Think of ""species"" as being more specialised than ""class"" (eg 種類 as species-genus)
Now think of plant breeding, where you're trying, in this case, to breed a new strain (or species) of grain so that you get more/heavier yields."
1811,衝,"collide",1,2016-07-01 16:24:28,"heavy in boulevard
Think of Newtonian physics and momentum = velocity x mass The more massive (heavier), the harder it is to stop. Now send a heavy object, like a truck, down a narrow boulevard and stopping it is going to be hard, so if anything gets in the way, a collision is the likely outcome."
1812,薫,"fragrant",1,2016-07-01 16:27:04,"I think of furze bushes, whose blossoms have a very heavy (coconut-y) fragrance. These plants are extremely inflammable and in fact are often deliberately burned each year."
1813,病,"ill",1,2016-07-01 16:31:07,"sickness, 3rd class
If you're feeling well, you're ""1st class"". If you've got a cold or flu, but can still go to work and stuff, you're ""2nd class"". If you feel ""3rd class"", though, you're probably ill enough to go to the hospital!
This is the same kanji as in 病気 and 病院 (sickness/illness and hospital)."
