framenr,kanji,keyword,public,last_edited,story
17,吾,"I",1,2016-06-16 13:53:17,"Represents the Buddhist idea of an impermanent self from the Sanskrit phrase ""five skandhas"". A skandha is ""heap"", ""bundle"", ""grouping"" or ""aggregate"", so actually that ""mouth"" underneath 5 actually represents the word ""skandha""."
45,寸,"measurement",1,2016-06-07 20:09:48,"Before #sticking# your Ikea furniture together, you should check all your measurements first. Measure across first, then down and make sure to dot your t before starting work."
46,肘,"elbow",1,2016-06-17 12:47:09,"Be careful not confuse with the elbow primitive (not a kanji) later."
64,頁,"page",1,2016-06-07 20:11:55,"I got this #one#-page book once called ""The little book of #clam#"""
84,賄,"bribe",1,2016-06-07 20:14:26,"I hate the corruption in this town. It seems like a hard-working criminal has to #shell# out all his #possessions# to avoid going to jail."
91,昭,"shining",1,2016-06-07 20:16:08,"What's with this teeth-whitening/shining fad? Some people's teeth look like the sun shines out of them. Of course, the point of it all is ultimately seduction!"
96,町,"village",1,2016-06-10 08:27:54,"What elevates a town from simple farm land? Streets."
145,沼,"marsh",1,2016-06-29 11:34:02,"water-seduction. Easy to think that the calm waters aren't dangerous, but you might be seduced too much by this idea and fall into a bog hole.
Be careful not to confuse with swamp."
177,灯,"lamp",1,2016-06-07 20:18:05,"What distinguishes farmland from villages is just the street signs. Oh, and the fire on spikes that they call ""lamps"""
178,畑,"farm",1,2016-06-07 20:19:40,"Who wants to ""slash and burn"" to make a farm? Cut the effort and just set fire to the field!"
184,漁,"fishing",1,2016-06-07 20:24:15,"Japanese farmers used to raise fish (carp to be exact) in the little runnels of their farmland. That's not proper fishing: for that you need to go to a real body of water and catch real fish."
187,墨,"black ink",1,2016-06-07 20:05:41,"Before squid were discovered, people would burn down vast areas (at least a ri) and then gather up the blackened soil to convert it into black ink."
188,鯉,"carp",1,2016-06-07 20:28:17,"Carp fish were once raised on pretty much every available ri of rice farmland. They were probably the first true ""farmed"" fish."
190,厘,"rin",1,2016-06-07 20:33:28,"Devaluation is what you get throw stuff off cliffs. Throw a ri, get back a rin."
191,埋,"bury",1,2016-06-07 20:49:07,"I prefer Kurt Vonnegut's idea of bombs and such: just play time in reverse and people lovingly dismantle them and bury the components back in the ground. Although, really I wouldn't like if they turned the silicon components in my computer back into #soil#."
194,胴,"trunk",1,2016-06-07 20:38:55,"The trunk of many organisms (like trees or vertebrates) is where you find the so-called ""undifferentiated tissue"" (#flesh# that's the #same#)"
196,尚,"esteem",1,2016-06-07 20:48:47,"Would you like to see my gallery of shrunken (little) mouths in jars? I've got a Nixon and some other esteemed characters in here (think Futurama, politician's mouths in jars)"
199,完,"perfect",1,2016-06-09 13:04:07,"Perfecting the art of house building only needs to to concentrate on two things: the #beginning# (""foundations"" in building speak) and the roof. All the rest is walls, and, so, unimportant.
Compare to complete: this house is incomplete, but that doesn't stop it from being perfect!"
204,寄,"draw near",1,2016-06-09 12:55:52,"Think of the story of the monkey's paw. The parents rub it and wish for their dead son to return. There is a strange feeling under the roof as something draws near the front door."
206,貯,"savings",1,2016-06-07 20:45:06,"I keep my savings (all the clams I've earned) hidden under my roof. There's a loose nail that I use as a switch to open up a secret compartment ..."
210,桂,"Japanese Judas-tree",1,2016-06-07 20:46:26,"Judas-shmudas. I'd just climb down the ivy growing on the tree and head to town to spend my silver!"
214,棚,"shelf",1,2016-06-07 20:47:55,"Outside of a dog, books are a man's best friend. #Shelves# are just a #wooden# #companion#, by comparison."
216,桐,"paulownia",1,2016-06-07 20:54:34,"How to distinguish the paulownia tree from the rest? It makes pollen (""paulown"") just the same as every other tree!"
217,植,"plant",1,2016-06-07 20:56:32,"In McBroom's Wonderful One-Acre Farm, it didn't matter what #tree# you planted, it would grow #straightaway#!"
219,枯,"wither",1,2016-06-07 20:57:19,"Trees get old, too, wither they want to or not."
220,朴,"crude",1,2016-06-07 21:02:17,"The crude wooden wand that Bumpkin McBupkiss brought from home marked him for special attention from Hogwarth's bullies."
221,村,"town",1,2016-06-07 21:06:45,"After a village (which is mainly characterised by street signs and lamps), towns can mostly be characterised by their use of chipboard---a cheap building material made from #wood# pulp and #glue#."
222,相,"inter-",1,2016-06-07 21:10:55,"Inter-personal relationships are about always thinking of the other person. What would I do in their shoes ... ""wouldn't I"" ... ""wooden I"" ... ""wooden eye""?"
223,机,"desk",1,2016-06-07 21:12:42,"This desk here is where I keep all my wood-wind instruments. Ooh! a nose-flute I didn't realise I had!"
227,案,"plan",1,2016-06-07 21:15:45,"Treehouses are great. You can climb up the tree, relax and work out whatever evil plan you want without anyone bothering you."
228,燥,"parch",1,2016-06-07 21:20:23,"In the parched land where I live (the Sahara), we have to put all the Christmas gifts (so many #goods#, since we are rich from selling oil!) on top of the #tree# so they don't burn from the #fiery# heat all around."
231,昧,"obscure",1,2016-06-07 21:23:24,"obscure: something that the #sun# has #not yet# reached. Like the continually mist-shrouded island at the start of Dr. Strangelove."
236,株,"stocks",1,2016-06-07 21:25:29,"In the before-times, when people used leaves as currency, they would plant trees in spring in the hope of reaping a vermillion (the highest-valued denomination of leaf) windfall in autumn."
237,若,"young",1,2016-06-07 21:28:15,"Although I don't agree with hippies in general, I do think that the young have the #right# to wear #flowers# in their hair."
239,苦,"suffering",1,2016-06-07 21:31:27,"Suffering is as old as the first flower. Flowering marks the high point of their lives. After reproducing, the rest is just old age."
241,寛,"tolerant",1,2016-06-07 21:34:59,"When people in the #greenhouse# #see# that it's best not to throw stones, it means they are being more #tolerant#."
243,葉,"leaf",1,2016-06-07 21:39:51,"Leaves are the power-generation part of a plant. The tree's frame supports them, but the energy they collect supports flowering and seed production so that a new generation of frames, leaves and flowers may live."
245,漠,"vague",1,2016-06-07 21:42:46,"If RTK isn't your first introduction to kanji (漢字), then this one will probably look vaguely familiar. If you let your thoughts run their course though (like running water), this idea will soon be washed away to the graveyard where it belongs."
246,墓,"grave",1,2016-06-07 21:44:58,"A graveyard is built on the soil of individual graves."
247,暮,"livelihood",1,2016-06-07 21:51:30,"My friend is an up-and-coming star in his field. As an undertaker, he's embarrassed to talk about his livelihood though. He hides his light under a bushel (of graves)."
250,兆,"portent",1,2016-06-07 21:56:50,"In Blade Runner, we really should have portended what would happen by the way Roy Batty reacted to the question about the turtle on its back."
251,桃,"peach tree",0,2016-06-07 21:58:49,"Tree of portent... yup, I like the angle of dark foreboding in the story of momotarou. Kind of parallels the Buddha's story and the connection with the Bo tree."
252,眺,"stare",1,2016-06-07 22:41:26,"Cassandra stared at the turtle back long and hard and what she saw with her #eye portended# doom."
254,状,"status quo",1,2016-06-07 22:05:39,"Unlike Seth Brundle in The Fly, when the turtle and the St. Bernard got merged, they were happy enough with the status quo. The dog got to enjoy lettuce and the tortoise got to lick his own balls."
256,然,"sort of thing",1,2016-06-07 22:16:21,"Not chihuahua, exactly, but some sort of flesh of dog sort of thing roasted over a fire. A kind of chihuahua chimichanga, if you will. (Note especially the ""sort-of-flesh"" rendering of 月 on the left)"
257,荻,"reed",1,2016-06-09 13:08:43,"An over-elaborate way to escape a pack of wild dogs: find a flowering reed and break it off. Use it to breathe underwater. Then set fire to everything so that the dogs will all run away. Just hope that the dogs don't get the same idea!"
262,告,"revelation",1,2016-06-07 22:21:21,"Reminds me of the sense of revelation in the film Gozu after we find out where that ""#cow#"" milk he put into his #mouth# actually came from."
268,脊,"spinal column",1,2016-06-07 22:25:24,"Look at me as I #strut# out confidently with my #fleshy# spinal column protected with its own #umbrella#."
269,合,"fit",1,2016-06-07 22:26:54,"If a kiss is the #meeting place# of two #mouth#s, it's vital that they actually fit."
270,塔,"pagoda",1,2016-06-07 22:30:10,"It has to combine architecture (building up of soil) and aesthetics (decoration with flowers) in a way that actually ""fits"" internally. Otherwise it's just a jumble of ideas/lines."
274,珠,"pearl",1,2016-06-07 22:34:41,"Actually, I suspect that these giant, polished #vermilion# #orbs# aren't pearls, but shiny mud balls. (so really they are dorodango!)"
275,現,"present",1,2016-06-07 22:37:10,"The orb of scrying lets you see all that's happening at this moment."
276,玩,"toy",1,2016-06-07 22:38:42,"Go back far enough (even so far as reversing the characters) and you'll see that the first toy was a ball: the ur-ball (beginning ball)."
280,呈,"display",1,2016-06-07 22:48:57,"The king props his chin on his sceptre to display his latest acquisition: an array of new gold teeth in his mouth."
281,全,"whole",1,2016-06-07 22:52:59,"The king felt whole after retiring under the umbrella with his entire entourage."
285,注,"pour",1,2016-06-07 23:02:57,"Picture King Canute, as the water pours over home, heedlessly. He even got his hair wet!"
293,銘,"inscription",1,2016-06-07 23:06:17,"The name inscribed inside the golden ring was ""Elbereth"""
294,鎮,"tranquillize",1,2016-06-07 23:08:30,"In Pulp Fiction, we're not supposed to know the golden truth inside the briefcase is. If we were to find out, we'd have to be tranquillised like in They Live."
295,道,"road-way",1,2016-06-07 23:12:22,"The way people drive these days, you need some neck out there on the road-ways."
296,導,"guidance",1,2016-06-09 09:48:28,"Dorothy should really have stuck the guidance she got to ""stick to the yellow-brick road-way"""
298,迅,"swift",1,2016-06-07 23:16:10,"To #hook# into the Arabic saying, ""the swift and the slow meet at the #crossing#"""
301,逃,"escape",1,2016-06-08 10:05:11,"Just think how absurd it is that the ancients saw a *turtle* plodding down the *road-way* and thought ""I know---that's a good way to draw the kanji for 'escape'"""
305,連,"take along",1,2016-06-08 10:09:27,"You should take along the simplest idea from the kanji with you, and don't go complicating it by thinking of transport or other more complicated ideas."
306,軌,"rut",1,2016-06-08 10:13:13,"Albert Einstein said that the definition of crazy is doing the same thing over and over and expecting different results. That's a serious rut in one's thinking. It's like if your *car* gets stuck in a rut and after gunning the engine *nine* times already and still going nowhere, you expect to get out the next time."
307,輸,"transport",1,2016-06-08 10:18:27,"Did you know that P&O Ferries was initially set up by French onion growers so they could transport their wares for sale in England? Japan had something similar, except they used a fleet of *cars* and it was an *association of butchers* wanting to bring their wares to market."
308,喩,"metaphor",1,2016-06-08 10:25:04,"Some topics in Japan are not really spoken about in direct terms, and so people speak in metaphors instead. The first people to mouth these was probably an association of butchers who wanted to sell their wares without offending people by talking directly about flesh and cutting and so on directly. So that's where the kanji for ""metaphor"" comes from."
309,前,"in front",1,2016-06-08 10:27:24,"Ever wonder why deer and such have their horns in front instead of on their asses? Well they wouldn't be very good at cutting the flesh of other deer if they were back there, would they?"
310,煎,"roast",1,2016-06-08 10:29:47,"Did you ever see one of those presidential ""roast"" things? It's supposed to honour the person, but he stands up in front of everyone and they really put his feet to the fire. What's with that?"
311,各,"each",1,2016-06-08 10:32:20,"It's hard to remember something as general as ""each"", so I mime letting my fingers do the walking over my mouth. To each his own, I guess."
312,格,"status",1,2016-06-08 10:38:19,"In theory, communism is supposed to do away with ideas of status. It's supposed to be ""to each according to his needs, from each according to his ability"". In practice, the best they have achieved is to give a tree to each person."
313,賂,"graft",1,2016-06-08 10:40:42,"The amount of graft in Cambodia is terrible. Every government employee is on the take, from teachers to doctors to police. To get by, you have to shell out to each one of them in turn."
314,略,"abbreviation",1,2016-06-09 13:37:22,"Computer guys (and guys in other fields) use abbreviations like RTFM, but here I'm trying to remember the abbreviation RFE. Remember the Fine Example of Rice Field E_. What the hell does E stand for? Just notice that each of the abbreviations has the same initials and work it out!"
315,客,"guest",1,2016-06-08 11:17:24,"Japanese use the same kanji to mean both ""guest"" and ""customer"". Each of them is under your roof, in any case, so you will treat them properly as a guest."
316,額,"forehead",1,2016-06-09 10:05:05,"A guest with a big head came to visit other day. He was from Easter Island, I guess, because his forehead was huge!"
317,夏,"summer",1,2016-06-08 11:24:52,"In the summer, when the tarmac gets too hot to walk on, I screw the animal legs off my head and put on my walking legs instead. Now I can walk better on the hot tarmac without burning my feet!"
318,処,"dispose",1,2016-06-08 11:30:37,"Think about the improper ways of disposing of litter. Nobody shits on their own doorstep, but it's surprising the number of people who will use their walking legs to move just a little bit away and let the wind dispose of it for them.
Think of the long stroke under wind as them making the minimum effort to get away from their doorstep."
319,条,"twig",1,2016-06-08 11:36:09,"Think of a bonsai tree. It's so tiny that you can even use your fingers as walking legs and walk right over the tree. If the tree is that tiny, imagine how small the twigs must be!"
320,落,"fall",1,2016-06-09 16:53:22,"Think of the falling of cherry blossom petals. The flowers at the top fall like drops of water. The funny thing is that #each# of the blossoms seem to fall at around the same time so the Japanese make a special festival out of it: hana-mi"
321,冗,"superfluous",1,2016-06-08 11:50:45,"Think of the primitive for wind and give it a secondary meaning of ""desk"" (机). Now imagine crowning it with another wooden covering. How superfluous!"
322,冥,"Hades",1,2016-06-08 11:54:23,"In classic mythology, there are 7 circles of hell (Hades). Here we see the outermost one, represented by a tyrannical sun wearing a crown, with the suggestion that there are 6 more circles below."
323,軍,"army",1,2016-06-08 11:59:50,"Imagine the armies of old, where the lords and generals (the crowned ones) are carried around in regal palanquins (cars) while the grunts (not pictured) do all the lifting and fighting. I guess that this kanji shows how much the nobles care about their army!"
324,輝,"radiance",1,2016-06-08 12:07:03,"Thinking back to ""army"", all the rays coming out of the regal palanquins (crowned cars) are probably the reason that we don't see any of the grunts: the amount of radiance simply blots out everything else from view."
325,運,"carry",1,2016-06-08 12:15:03,"One of the main reasons that the influence of the Roman empire carried so far is that they engaged in a massive amount of road-way building to carry their armies."
326,冠,"crown",1,2016-06-08 12:20:41,"The crowning achievement of royalty is duping the people into thinking that, even from the beginning, a kind of divine right is attached to the crown."
327,夢,"dream",1,2016-06-08 12:22:56,"An elaborate dream-catcher made of flowers woven into nets crowns my evening and lets me dream good dreams."
328,坑,"pit",1,2016-06-08 12:39:10,"Decomposing ""whirlwind"" into top-hat and wind...

My Japanese gardener is very industrious but he doesn't speak English well. When I asked him the other day to dig a pit, I went out later and found a huge mound of soil and a top hat beside it. When I lifted up the top hat, I heard a huge howling wind from under it. It seems that my gardener had misunderstood the scale of the pit that I wanted (more like a cavern!), but at least I am thankful that he put the top hat on top so that nobody would fall in."
330,享,"receive",1,2016-06-08 12:49:26,"The received wisdom is that if a child receives good nutrition, he will grow up to be tall."
331,塾,"cram school",1,2016-06-08 12:59:49,"I imagine cram school to be some kind of high-tech indoctrination method. There's some sort of transmitter that pumps out something that's received by anyone around it. I've never been in there (too scared) but I've peeked over the enclosing mound of soil and seen it happen with my own eyes."
332,熟,"mellow",1,2016-06-08 13:08:06,"The tall kids and the round ones never could get on together, but after sitting with each other at the campfire, their attitudes began to mellow and mature. The fire mellowed them out and let them receive a more rounded world-view."
333,亭,"pavilion",1,2016-06-08 13:17:46,"Pavilions are grand things, but there can be a lot of pettiness on the part of their designers. In the competition to see who can build the tallest, one guy I know just crowned his with a nail. It looked stupid, but it did make it taller than any other pavilion!"
334,京,"capital",1,2016-06-08 13:22:07,"The capital is where you see the biggest inequalities in society. The tall (the rich) tower over the small (the poor). I guess that's capitalism for you."
335,涼,"refreshing",1,2016-06-08 13:27:05,"Despite all the inequalities inherent in the capital, at least a cool refreshing shower can be enjoyed by all."
336,景,"scenery",1,2016-06-09 09:32:18,"There's probably no more breathtaking scenery than looking out at the sun rise from the top of Tokyo Tower, with the all capital beneath you."
337,鯨,"whale",1,2016-06-08 13:32:46,"In warfare, we talk about ""capital ships"". In nature, the ""capital fish"" must be a whale. Of course, it's a bit backwards to call a whale a fish (ie fish-capital, not capital fish)."
338,舎,"cottage",1,2016-06-08 13:39:52,"Whereas a lord can have all his wants satisfied completely (全), subsistence farmers have much more meagre cottages: just an umbrella and a small plot of land (a cottage garden) to feed their mouths.
With ""lidded crock"": under a humble cottage with only an umbrella for a roof, the inhabitants fill their lidded crocks with kimchi for the winter. (making kimchi in lidded crocks is a true cottage industry)"
339,周,"circumference",1,2016-06-08 13:51:07,"Between the times when manholes were invented and the time when manhole covers were perfected, people tried all sorts of weird ideas, including using lidded crocks as a hood for the hole. Many a crock was lost, however, to people not matching the circumference of the hole to the circumference of the crock! I'm sure they had a victory lap once they finally figured that out!"
340,週,"week",1,2016-06-08 13:54:13,"The days of the week are like a looping roadway, with the days lapping each other (sun->mon->...->sun) with each full circuit around the circumference."
341,士,"gentleman",1,2016-06-08 13:58:11,"The samurai class were the #gentlemen# and scholars of their day: much more refined than the common clod-hoppers."
342,吉,"good luck",1,2016-06-08 14:08:01,"This represents the deluxe ""samurai"" version of a plain lidded crock. Most of the ""good luck"" that people ascribed to it at the time would most likely be explained away today by our knowledge of microbes and bacteria and such. The tighter-fitting lid meant less contamination, so the samurai had the ""good luck"" to avoid many food-borne maladies."
343,壮,"robust",1,2016-06-08 14:13:51,"So far, nobody has been able to give me a robust explanation of how four turtles came to be samurai. And don't try to give me the story of their gentlerat trainer, either. (teenage mutant ninja turtles)"
344,荘,"villa",1,2016-06-08 14:19:20,"I think of the grand French villas (though more like palaces to you and me) like in Versailles, with the elaborate flower gardens guarded by imported turtle samurai. This flowering of rococo excesses must have seemed so robust before the revolution."
345,売,"sell",1,2016-06-08 14:24:33,"A samurai turned ronin (sold out by his daimyo) is reduced to selling wind-up false teeth in the market-place (basically a dental crown with legs!)"
349,書,"write",1,2016-06-09 12:31:03,"For a gruesome image, imagine carving the word ""brush"" on your tongue and using it as a writing instrument."
350,津,"haven",1,2016-06-09 12:28:41,"Think of The Great Wave off Kanagawa, the ukiyo-e by Hokusai. See the way he paints all that water and spray with his brush? Then notice that there are some boats out there! They need to find a haven from these waves."
351,牧,"breed",1,2016-06-09 10:09:27,"Taskmaster forcing cow to breed. It sounds cruel, but if nobody forced cows to get pregnant, we wouldn't have milk all year round."
352,攻,"aggression",1,2016-06-09 10:11:30,"It's a crafty taskmaster that uses just the right amount of aggression: not too much that the slaves can't work, and not so little that they start getting ideas about mutiny!"
353,敗,"failure",1,2016-06-09 12:27:11,"Back in the 80's, Maggie Thatcher said (to paraphrase) ""only failures take the bus"". I disagree, Maggie: the real failure is let money become your taskmaster"
355,故,"happenstance",1,2016-06-09 12:25:06,"Heisig's talk of ""fate"" here is completely wrong! Kismet (fate) and happenstance (coincidence) are two completely different things.
Coincidentally (ie, by happenstance), I did try telling him this once, but he went on like an old taskmaster, completely deaf to my cries."
356,敬,"awe",1,2016-06-09 10:27:38,"Think of different kinds of awe. Do you use #flowery phrases# because you are in awe of the higher-ups, or are you really in awe of the #taskmaster#, who will whip you awe-fully if you don't learn them correctly?"
358,警,"admonish",1,2016-06-09 12:19:50,"After carelessly using low speech, I was admonished to use more awe-filled language (honorifics) in future.
Versus rebuke, this seems less harsh---just words instead of the threat of knives.
Versus ""chastise"", this is a more ""grown-up"" meaning. Children here are admonished to leave more childish speech behind and move up to polite speech.
To admonish also includes a sense that there is something that needs to be improved in the future, as opposed to the other two which focus only on past events."
359,計,"plot",1,2016-06-09 12:13:26,"Think of the black and white film Metropolis. You may have seen some scenes from it in the video for Queen's Radio Gaga. There's an image of a man who has to move these giant needles on a clock face so that they match up to the position of lights that flash on around the edge.
The undercity workers get together and talk about their plight as slaves to the machine and eventually talk gets around to a plot to overthrow the higher classes and free themselves from slavery to the machine and its giant needles."
360,詮,"elucidate",1,2016-06-09 12:08:22,"If you're elucidating (rather than just teaching, instructing, etc.) then your words express the whole of the idea clearly to the listener. 

""Lucid"", from which elucidate derives, conjures up an idea of clarity, in which you can see the whole thing, as opposed to, say, ""teaching"", where the teacher breaks it down into smaller parts that you can understand, or ""instruction"" where you're passing on a method rather than something that you can see in your mind's eye)"
362,訂,"revise",0,2016-06-09 11:59:13,"Revise, revise and revise until you have all the words nailed down."
363,訃,"obituary",1,2016-06-09 11:42:20,"Usually obits are favourable to the deceased, but occasionally they're negative, in which case it's like a magic wand that waves over all the words you've heard about that person before and breaks the spell they had over you."
364,討,"chastise",1,2016-06-09 11:39:24,"I was chastised for not sticking to my word.
Note similar words ""rebuke"" and ""admonish""
To distinguish ""chastise"", consider that you chastise children, so this mnemonic could be put in the context of a child promising to tidy up before dinner and then being chastised for not sticking to his word."
365,訓,"instruction",1,2016-06-09 11:29:19,"The disciple receives instruction. If he is ready, the words of the master flow into him like a stream of wisdom."
