framenr,kanji,keyword,public,last_edited,story
1226,録,"record",1,2016-06-22 19:04:32,"Think of a criminal record as something tarnishing your reputation (the metal bit) and then imagine the broom brushing away all the rice-grains making the metal all shiny and clean again. Also imagine ""time served"" in prison as being all about this kind of thing, with your release meaning that you're fit to be a member of society again, your debt to society cleared."
1227,剥,"peel off",1,2016-06-22 19:06:16,"Same idea for broom + rice grains in ""record"", but this time imagine sand-blasting (pumping a mix of water + sand, or in this case, rice-grains, at high pressure) to peel off outer layer of crud from something."
1228,尋,"inquire",1,2016-06-22 19:08:41,"Top, broom, sweeps away various alternative conversational topics. Bottom three together indicate crafting a specific utterance that sticks the person into having to answer one thing. Think of a politician in an interview. They want to duck the question, so you have to keep repeating this process of inquiry until they give you a direct answer."
1229,急,"hurry",1,2016-06-22 19:10:05,"X-over heart is usually a mood or something like that. I was in such a hurry to finished cleaning the house that I tied all my brooms together so that the job would be finished quicker."
1230,穏,"calm",1,2016-06-22 19:13:01,"Kanji looks quite tranquil/calm. Wheat growing in the field, a vulture perched above, not bothered by you/you not bothering it while you get into the flow of just cleaning up with your broom.
Think of heart as first part and work out from there."
1231,侵,"encroach",1,2016-06-22 19:15:02,"I'm thinking of three elements on the right as like loss of control/letting go. Your crown has been swept off (broom standing for ""swept off"") and has landed on your crotch.
When a person approaches you in this kind of vulnerable state, they are encroaching on your personal space."
1232,浸,"immersed",1,2016-06-22 19:20:06,"water + loss of control/letting go (or water + ""discombobulation"")
Immersed can either mean that you've let yourself go and have gotten into the flow of something, or it could mean being immersed in something without your will. Either way, water + discombobulation seems to work OK as a mnemonic."
1233,寝,"lie down",1,2016-06-22 19:23:40,"""lie down"" in the sense of lying down to go sleep.
Under a roof, so this is a normal bedtime.
Turtle stands for portent, so a hint of dreams to come. Discombobulation like an overturning of the regular order. Either you're deliberately letting go, inviting the turtle to bring you dreams, or you have no choice and you fall asleep regardless, allowing the (more literal) turtle to invade your mind."
1234,婦,"lady",1,2016-06-22 21:27:53,"Woman, broom/apron.
Ah, the perfect lady (so much for women's lib in kanji!)
Methinks the lady doth protest too much if she thinks she shouldn't be sweeping the floor dressed only in an apron."
1235,掃,"sweep",1,2016-06-26 17:33:39,"zoom in on the kanji for ""lady"" and we see her fingers holding the broom, doing her sweeping chores.
fingers, broom, apron"
1236,当,"hit",1,2016-06-23 12:01:42,"Remember the Atari games company? Well, one reading for that is 当たり. Now think about the Atari logo which can be seen by (a) taking the top part and turning it upside-down, or (b) rotating the bottom part 90 degrees left, removing the top line and spreading the two sides out along the bottom.
Oh, Atari means ""hit"". They had lots of hit games."
1237,彙,"glossary",1,2016-06-22 19:31:45,"Instead of ""broom"" here, think of it as ""mutually"" (互) with a bit lopped off.
Next, imagine reading a book that needs a glossary, say a Japanese book that has vocab explanations for English speakers. So the lopped-off ""mutually"" suggests that this glossary only goes one way, from JA -> EN.
Next, consider ""fruit"" underneath as having the meaning of ""chapter"" (no ""say"").
So we have a Japanese text where we have a one-way (not mutual) glossary ""crowning"" each chapter."
1238,争,"contend",1,2016-06-22 19:35:45,"bound-up rake
Think of contenders in a gladiatorial ring. One guy has something that looks like a rake (a trident, perhaps) and the other guy has bound it up by sticking something like a sai or jitte through it. (types of weapons that are mostly used for grappling/locking an opponent's weapon)
(""I coulda been a contender"" transplanted to ancient Rome, in other words)"
1239,浄,"clean",1,2016-06-27 20:33:57,"Think ""contention"" for the right and imagine a ""bone of contention"" is what is binding up the rake/trident. 
This kanji has meanings like cleanse, purify or exorcise so imagine the water as metaphorically exorcising the bone of contention between two people. Or think of using the rake of contention to clean out your teeth."
1240,事,"matter",1,2016-06-22 15:16:52,"Japanese use this all the time in conversation, like ""そう言う事"" (""that thing/matter that you say""). It's like a form of focusing, turning some abstract thing into a more concrete thing within the context of the conversation.
With that in mind, I think one-mouthful-rake: gathering up a pile of ideas/speech into one (mental) mouthful with a rake."
1241,唐,"T'ang",1,2016-06-22 15:25:41,"Bat-cave quite often appears in relation to governments (municipality, courtyard, government office), so I suppose it's not too hard to remember here.
I read about the T'ang dynasty on Wikipedia and it describes it as being a period of great prosperity and population growth, with influences further afield than most other Chinese dynasties.
I'm going bat-cave for some sort of officialdom, rake to symbolise both agricultural advances, and mouth to symbolise population growth."
1242,糖,"sugar",1,2016-06-22 15:29:33,"As it happens, sugar was first grown on a large scale in China during the Tang dynasty: https://en.wikipedia.org/wiki/Tang_dynasty#Tea.2C_food.2C_and_necessities
I'm guessing that it's rice on the left rather than wheat because sugar cane production needs lots of water (same as rice)."
1243,康,"sane",1,2016-06-22 15:31:55,"Batman as a Pastafarian, wearing a colander (sieve) on his head in his Bat-cave. What, you want to tell Batman that he's insane? Be my guest ...
Anyway, rake + rice-grains does suggest sieving/winnowing quite easily."
1244,逮,"apprehend",1,2016-06-30 10:13:56,"Kanji has both meanings: apprehend and chase. I think that chase gives a better reason why we have the roadway, but I'll just file that away for now.
You hear of people ""combing"" an area to apprehend a suspect, but I guess that the Japanese would rather ""sieve"" the area.
I confuse this with ""intercept"" all the time. The kanji for sieve kind of looks like a Segway, so with that as a clue, I'll say that it's easier to apprehend someone if they're trying to get away on one."
1245,伊,"Italy",1,2016-06-22 19:45:09,"No jobs in Italy, apparently. Everyone just gets a mop and has to keep all those Roman ruins clean for the tourists. Imagine a person goofing around and putting the mop on his head, pretending he's in the Beatles."
1246,君,"old boy",1,2016-06-22 19:47:33,"きみ
mop over mouth. Imagine in the 60s/70s when long hair came into fashion and all the ""old boys"" (more like ""young men"", but whatever; keyword is what it is) had hairstyles like mops that covered everything above their mouths."
1247,群,"flock",1,2016-06-22 19:48:27,"きみ beside sheep
With their mop-tops, the ""old boys"" blended seamlessly into the flock of sheep."
1248,耐,"-proof",1,2016-06-27 21:12:30,"comb-glue
Get tangle-proof (ie, won't mat/stick together) hair with our very finest ivory combs! (The fact that elephants aren't extinction-proof and probably won't stick around much longer is beside the point)"
1249,需,"demand",1,2016-06-22 19:53:24,"Supply of rain outpaces the demands of a comb (which doesn't partake greatly of the available water, compared, say, to a bucket), apparently."
1250,儒,"Confucian",1,2016-06-22 19:56:02,"Confucius say ""wise man no try catch rain with comb"" (nor play leapfrog with unicorn, but that's a different story, kanji #11493)"
1251,端,"edge",1,2016-06-22 19:58:02,"If you stand a comb up on its bottom edge, it looks like a mountain! (think axial reflection in line between mountain and comb)"
1252,両,"both",1,2016-06-22 20:06:42,"Reminds me of the classic Greek figure/figure design (Greek Key/Meander), especially the version where T shapes interlock from both sides. We see something similar here with the kanji for ""mountain"" appearing inside and also appearing rotated 180 degrees above it.
In Greece, this was often used to decorate ceilings, so start drawing this kanji from there."
1253,満,"full",1,2016-06-22 20:12:33,"I think of fullness of expression, understanding, or whatever.
You can define a plant as ""needing water"" (a purely physical interpretation) or ""producing flowers"" (an emotional or metaphorical one) but the fullest explanation/understanding needs to incorporate both."
1254,画,"brush-stroke",1,2016-06-22 20:16:47,"Similar to the story for ""full"". There is the physical aspect of the ink ""shooting up"" onto the canvas, but there's also this empty space giving rise to the act itself, giving the idea of a ""pregnant void"" and the spontaneous nature of the stroke itself.
A lovely kanji."
1255,歯,"tooth",1,2016-06-22 20:19:52,"Think of a pair of molars. The top one ""stomps down"" (think ""footprint"") onto the rice cupped in the bottom one (think of it as zooming in on the middle three strokes of ""concave"" rather than Heisig's suggestion of ""shovel"")."
1256,曲,"bend",1,2016-06-22 20:21:41,"Bending a note on a guitar by stretching them out of place on the fretboard (thus changing the tension, and hence the pitch)"
1257,曹,"cadet",1,2016-06-22 20:26:37,"Think of a cadet school, where camaraderie is built up by a communal ""bending together"" to their tasks over the days. The one at the top indicates their unity of spirit and fellow-feeling for each other. 
The kanji also has meaning of comrade, fellow as well as office/official, so I'm using ""camaraderie"" as a useful interpretation in the kanji that follow."
1258,遭,"encounter",1,2016-06-22 20:27:17,"Cadets have an encounter on the roadway. It's a feeling of meeting a fellow-traveller."
1259,漕,"rowing",1,2016-06-22 20:27:57,"Skulling team. Cadets all lined up with water splashing by their sides."
1260,槽,"vat",1,2016-06-22 20:30:35,"In the same way that cadets are taught to pull together (being in it for the team instead of their own selfish ends) and mature, vats are used to mature wines and spirits so that harsh notes are eliminated and more well-rounded character develops.
Raw material of vats is wood, obviously."
1261,斗,"Big Dipper",1,2016-06-22 20:32:17,"Interesting that the first two strokes are the dots. Dots in a clear white page. Stars in reverse. One line obviously points north, the other indicates our bearing in relation to it.
Of course, ursa major looks like a dipper, so measuring cup (or scoop) is apt."
1262,料,"fee",1,2016-06-22 20:39:11,"Also ""materials"" as in 材料 (ingredients/materials). Imagine paying labourers at least part of their fee in cups of rice. Or maybe the farmer charges them a fee for meals! (Holiday in Cambodia: ""you'll work harder with a gun in your back for a bowl of rice a day"")
Also, think of interpretation of strokes in Big Dipper as representing a kind of ""reckoning"". In navigation, the meaning is obvious, but also here the amount of the fee is reckoned by what's fair/what the fee-setter thinks he can get away with."
1263,科,"department",1,2016-06-22 20:40:51,"Imagine laureates resting on their laurels (imagine wheat in this role) and everyone in the department measured up on this basis (with a big measuring scoop because they're obviously such a big deal)"
1264,図,"map",1,2016-06-22 20:42:32,"pent-in big dipper. Every map has an embedded idea of north and provides a means of reckoning how to get from A to B.
Nice balance in this kanji, how all strokes of Big Dipper move/bend to fit in so it doesn't end up looking cramped."
1265,用,"utilize",1,2016-06-22 20:46:46,"I'm not sure if this is really ""meat"". Nonetheless, remember that this is the kanji that they utilise in the 常用 of Jouyou (daily use) kanji (what we're learning now)."
1266,庸,"comfortable",1,2016-06-22 20:50:37,"Forget ""screwdriver"" here. Batman was becoming more and more comfortable in his Zen garden, raking out pictures of all the Jouyou kanji.
Or if you want, consider this a ""man-cave"", where a man goes to get away from his nagging wife, comfortable amid his gardening and general tools (rake and screwdriver), even though he's probably not very good at using them..."
1267,備,"equip",1,2016-06-22 20:51:50,"What would McGyver do in this situation. Hmmm... flowers up on top of the cliff and me equipped with only a screwdriver .... I'm sure he'd think of something awesome."
1268,昔,"once upon a time",1,2016-06-23 13:42:35,"salad days/mukashi"
1269,錯,"confused",1,2016-06-23 13:42:50,"Once upon a time when metal monsters roamed the Earth. Wait! I'm confused!"
1270,借,"borrow",1,2016-06-22 21:44:15,"Alpha Desperation March, by The Mountain Goats.

person + mukashi. When you borrow, you soon forget who gave you the money."
1271,惜,"pity",1,2016-06-22 21:47:51,"Probably ""saudade"" (a Portuguese/Brazilian word) is more fitting, at least from the primitive decomposition of state of mind + mukashi."
1272,措,"set aside",1,2016-06-23 13:45:24,"Think of the start of The Princess Bride. Both Savage and Falk set aside the mukashi story (Savage because there might be kissing and stuff, and Falk because he is basically engaging in reverse psychology). It shouldn't be hard to remember fingers here.
Anyway, stuff that's set aside is easily forgotten about once it leaves your fingers (think lost keys or whatever)"
1273,散,"scatter",1,2016-06-23 13:46:26,"I think of a master chef (the taskmaster) making his signature salad dish with bits of meat and salad expertly scattered on the plate to make it look interesting."
1274,廿,"twenty",1,2016-06-23 13:46:56,"Either 1 stroke more than ten or 1 less than 30."
1275,庶,"commoner",1,2016-06-23 13:47:40,"Commoners have to collect bat guano from the caverns to use as fuel. Imagine them stinking from the job."
1276,遮,"intercept",1,2016-06-30 10:51:57,"The Green Police set out in their green interceptors to intercept the commoners on the road because all the bat guano they're burning is pumping out CO2, but also just because it stinks."
1277,席,"seat",1,2016-06-23 13:48:53,"If you go to the caverns to collect bat-guano, be sure to bring a towel to use as a seat."
1278,度,"degrees",1,2016-06-23 13:51:37,"Think of all the ammonia in the caverns where the commoners collect the bat-guano. There are different degrees, with the deeper caverns being pretty much fatal. Of course, your crotch is another place where the smell of ammonia can emanate from, if you don't wash regularly, something that commoners don't do to the same degree as richer people."
1279,渡,"transit",1,2016-06-23 13:53:59,"Think of a barge transiting a canal to get from one place to another. With water + degree, you get the idea of Plimsoll line which marks the degree to which the boat is laden down. Since the canal isn't very deep, a barge could be loaded down to such a degree it could get stuck, so it won't be allowed to transit."
1280,奔,"bustle",1,2016-06-23 13:54:54,"Dog goes a-ratting in a haystack, a bustle of activity with hay scattering everywhere."
1281,噴,"erupt",1,2016-06-23 13:58:18,"Apparently the right side represents ""decoration"". I'm going to call it a ""bower"", like the elaborately decorated bower of a bowerbird.
After luring in/satisfying its mate with an attractive bower, the male bower bird erupts from the entrance (mouth on left) to mate with the female post haste.
Oh, as for bower = haystack + shell, the bower itself is made from twigs and hay/straw scavenged from a haystack, while the shells are for decoration."
1282,墳,"tomb",1,2016-06-23 14:00:18,"Think of tomb as being like an underground mausoleum. It just looks like a pile of earth from outside, but it's like a finely-decorated bower inside."
1283,憤,"aroused",1,2016-06-23 14:01:03,"state of mind, bower.
Obviously what sort of state the male bower bird is when he sets to building his bower and sees a female approaching."
1284,焼,"bake",1,2016-06-23 14:05:33,"Summerisle's yearly bake meet (from the film, ""The Wicker Man"")
The big straw/wicker man is just haystack + human legs.
Think of the Simpson's Halloween episode ""easy bake coven"" to imagine the connection to the film."
1285,暁,"daybreak",1,2016-06-23 14:07:41,"Think of Edward Woodward's speech about the future of Summerisle at the end of The Wicker Man. Then imagine a straw man skeleton lit up by the sun rising at daybreak the following day."
1286,半,"half",1,2016-06-23 14:09:40,"karate chop
Stroke order of : Dots, two, line through middle"
1287,伴,"consort",1,2016-06-27 20:27:02,"A person's other half (not necessarily a wife/husband). Hiro still consorted (after a fashion) with Charlie even when there was like a 40 year age gap (he was half her age at the time)"
1288,畔,"paddy ridge",1,2016-06-23 14:12:38,"These are temporary ridges that allow for selective flooding of sections of a rice field. So you might be doing succession planting, with half the field planted some time after the first, so half is wet and the other half is dry, depending on the stage of growth.
Anyway, easy enough to remember rice field, half."
1289,判,"judgment",1,2016-06-23 14:13:44,"OK, I'll go with Heisig's Solomon story since it has both ""half"" and ""cut"" (or, ""sabre"" at any rate)."
1290,拳,"fist",1,2016-06-23 14:16:48,"quarter: halving the last stroke of half (remember to draw last stroke from the top horizontal stroke).
Look at your hand. Each finger has three sections, so if you include the bones in the back of your hand as a fourth section and curl your fingers up, you're left with only one section left visible (ie, one quarter = just the bones on the back of your hand)."
1291,券,"ticket",1,2016-06-23 14:20:06,"quarter-sword
Imagine a ticket that has a perforated bit, one quarter of the way through, to separate the ticket from the stub. Instead of a scissors mark saying ""cut here"" or regular perforations (tear here), there's a picture of a sword so that the ticket collector knows where to cut with his sword (so you don't lose your fingertips)"
1292,巻,"scroll",1,2016-06-23 14:23:44,"This is more like ""rolled up"", as in 手巻き寿司 (hand-rolled sushi).
Imagine using a scroll to roll up sushi. Put down the nori, then put the ingredients into the bottom three quarters (leaving one quarter of the nori at the top uncovered), then roll it up like a snake coiling around itself."
1293,圏,"sphere",1,2016-06-23 14:29:09,"pent-in scroll
As in ""sphere of influence"", not a 3-d object as such.
This is about the limited nature of any sphere of influences, so ""pent-in"" gives that idea of a boundary.
Think of a magic scroll that has an effect only in a limited sphere around the caster."
1294,勝,"victory",1,2016-06-24 10:18:00,"Body-quarter-power
Think of it as a Pyrrhic victory. Many bodies (flesh) after the battle, leaving your force at only one quarter strength."
1295,藤,"wisteria",1,2016-06-23 14:39:42,"wisteria is a climbing legume (like sweet pea, I guess)
Flowers at the top are obvious
Flesh on the left is probably some other plant that it's climbing up (the plant having no ""body"" of its own as it's a climber)
For the rest, I'm going to say that it can grow in poor quality soil, so it needs only one quarter of the amount of fertiliser (rice grains standing in for bone meal, say) that other plants need (being a legume, it can fix its own nitrogen)."
1296,謄,"facsimilie",1,2016-06-23 14:44:22,"Think of the predecessor of the fax machine: the telegram. You're charged by the word, so you have to take the body of your text (like body of email) and shrink down the words to/by a quarter."
1297,片,"one-sided",1,2016-06-23 14:49:04,"A very ""orthogonal"" view of half a tree (mostly right-angles). Note that the vertical strokes go first, starting with the longest one.
One-sided relationship. Guy on one knee offering something only for someone to stab him on the inside of the elbow with a walking stick (like the social worker and guy in wheelchair characters in Little Britain, perhaps)"
1298,版,"printing block",1,2016-06-23 14:54:14,"One-sided, anti.
Printing block has the mirror image of the text to be printed and is only one side/aspect of printing. Bring block and paper together to get the whole picture."
1299,之,"of",1,2016-06-23 15:06:47,"Mark ""of"" Zorro (more or less; has three strokes, ""eh""?)
So, anyway, this is one way to write これ or この, though I guess that kana are more usually used.
I'll just call this ""Zorro"" in stories."
1300,乏,"destitution",1,2016-06-23 15:08:28,"A drop of Zorro. A drop modifies something usually, so imagine a huge modification to the Zorro story where Don Diego is unmasked and is given such a huge fine for embarrassing the authorities that he becomes destitute.
Note that this is one half of the word ""poor"": 貧乏"
1301,芝,"turf",1,2016-06-23 15:09:32,"Flowers, Zorro
On his home turf (a beautiful hacienda with flowers everywhere), Zorro practices his fencing skills."
1302,不,"negative",1,2016-06-23 15:11:49,"Stroke order is counter-clockwise (negative to clockwise) after first one."
1303,否,"negate",1,2016-06-23 15:14:58,"Think of Bill and Ted. No way! Way! A particular way of negating what the other person said.
Anyway, negative is a general concept, while ""negate"" is a verb and implies that someone is saying it (with mouth)."
1304,杯,"cupfuls",1,2016-06-23 15:19:58,"I like the idea of negative space/positive space. Like an empty measuring cup is just wood until it's filled up."
1305,矢,"dart",1,2016-06-23 15:22:49,"Think of Cupid's darts. A heavenly creature dropping darts from the sky."
1306,矯,"rectify",1,2016-06-23 15:25:52,"Think of Scrooge. He's given three chances to rectify his life/behaviour so he's not such a Scrooge any more.
Think of dart like Cupid's darts (bringing love of humanity back to his life) or darting his conscience, and the three ghosts as angels sent to make him rectify his existence."
1307,族,"tribe",1,2016-06-23 15:27:53,"Ancient tribes, armed with atlatls. Each dart has a long banner attached so that when they're out hunting, you can see which tribe they are by the banner. Also, it looks really cool, like tracer bullets in films."
1308,知,"know",1,2016-06-23 15:31:40,"I like ""know-it-all"". Always so quick and eager to show how much they know, always darting into conversation with their big mouths.
Or look at mouth as a target (or even a dartboard). Those who know just shoot darts wildly, but the person who knows will hit the mark with their darts."
1309,智,"wisdom",1,2016-06-23 15:33:21,"wisdom is knowledge that is built up over time (suns). Or it is knowledge that is tempered by age (time/suns, again)."
1310,挨,"shove",1,2016-06-23 15:44:14,"finger | elbow/dart
""You can take this job and shove it"":
Hold fingers of left hand in front, bring right elbow up to slap it (a hand signal for ""fisting"") and then dart out the door before they can retaliate."
1311,矛,"halberd",1,2016-06-23 15:47:24,"Mao (マオ) Tse Tung said ""change must come at the end of a halberd"" (instead of ""at the barrel of a gun"")"
1312,柔,"tender",1,2016-06-23 15:57:57,"Seems to evoke ideas of ""internal"" or ""soft"" martial arts like Tai Chi or jujutsu. So I imagine this kanji as meaning ""supple"", ""gentle"" or ""soft"" as they relate to the movements of those martial arts. So tree is rooted in the ground (internal art) and the supple movements of the branches are supposed to represent how you're supposed to ""tenderly"" slice through opponents with your halberd."
1313,務,"task",1,2016-06-23 16:06:32,"I have a memory of some martial arts film (36th Chamber of Shaolin) where a ""sun and moon"" halberd is used. All chambers had their own taskmaster, so I suppose that building up strength (to wield this fairly heavy weapon, with metal blades on both ends) would be the main point in learning to use this effectively.
Oh, to relate it to task, think of ""12 tasks of Hercules"", thence to the 36 Chambers and finally to halberd, with the taskmaster focusing on building muscle strength."
1314,霧,"fog",1,2016-06-23 16:09:10,"Think ""fog of war"", although this looks more like a drizzle than a pea-souper.
Anyway, the warrior's training tasks with use of the halberd is ideal for limited visibility because of its long reach: just strike out into the fog and you're sure to hit someone."
1315,班,"squad",1,2016-06-23 16:10:45,"Squaddies out on furlough. Their meat spear poking out between two balls."
1316,帰,"homecoming",1,2016-06-23 16:12:15,"I think of this as a soldier returning home, laying down his spear and returning to the lady of the house (who will hopefully have swept up to make the place nice and clean and tidy for his return)."
1317,弓,"bow",1,2016-06-23 16:13:36,"Not quite the same as the primitive for snake (self), but close enough. Imagine shooting snakes from the bow."
1318,引,"pull",1,2016-06-23 16:16:05,"Pictograph of pulling a bow (curvy bit is the wood, walking stick is string)"
